{
  "schema_version": "0.1",
  "run_id": "2a9c7b13-5d84-4e62-8f01-3c7d9e2b5a81",
  "project_id": "1f0b8a42-7c3e-4d51-9b6a-2e8f5c1d4a70",
  "contract_version": "0.1",
  "data_classification": "synthetic",
  "dataset": {
    "dataset_id": "4c7e5d35-7f06-4084-a123-5e9f1a4d7ca3",
    "dataset_version_id": "8a3c1b79-b34a-44c8-a567-9c3d5e81b0e7",
    "version": "bfcl-v3-base-1.3",
    "content_sha256": "sha256:a3f1a3f1a3f1a3f1a3f1a3f1a3f1a3f1a3f1a3f1a3f1a3f1a3f1a3f1a3f1a3f1",
    "source_revision": "ea13468"
  },
  "suite": {
    "suite_id": "9b2d0c8a-c45b-45d9-b678-ad4e6f92c1f8",
    "suite_version_id": "ac1e9d9b-d56c-46ea-8789-be5f7a03d209",
    "version": "demo-16-1.0.0",
    "case_manifest_sha256": "sha256:b7c2b7c2b7c2b7c2b7c2b7c2b7c2b7c2b7c2b7c2b7c2b7c2b7c2b7c2b7c2b7c2",
    "case_count": 16,
    "domains": ["gorilla_file_system", "vehicle_control", "trading_bots", "travel_booking"]
  },
  "target": {
    "target_id": "3b8d6c24-6e95-4f73-9012-4d8e0f3c6b92",
    "target_version_id": "5d6f4e46-8017-4195-b234-6f0a2b5e8db4",
    "version": "golden-1.0.0",
    "adapter_version": "golden-1.0.0",
    "config_fingerprint_sha256": "sha256:b7c2b7c2b7c2b7c2b7c2b7c2b7c2b7c2b7c2b7c2b7c2b7c2b7c2b7c2b7c2b7c2"
  },
  "runner": {
    "runner_version": "0.1.0",
    "runner_id": "6e5a3f57-9128-42a6-8345-7a1b3c6f9ec5"
  },
  "evaluator": {
    "evaluator_version": "0.1.0",
    "failure_taxonomy_version": "0.1.0"
  },
  "retry_policy": {
    "max_attempts": 3,
    "backoff_ms": 2000,
    "lease_ttl_ms": 120000
  },
  "repetition_index": 0,
  "code_revision": "9027014",
  "created_at": "2026-09-01T10:15:30Z",
  "started_at": "2026-09-01T10:20:30Z"
}
